{
  "$schema": "http://json-schema.org/draft-07/schema#",
  "title": "Aether Model Card Schema with Template Support",
  "type": "object",
  "required": [
    "identity",
    "validation_profile"
  ],
  "properties": {
    "validation_profile": {
      "type": "string",
      "enum": [
        "defense",
        "healthcare",
        "financial"
      ],
      "description": "Profile that determines conditional validation rules"
    },
    "identity": {
      "$ref": "./defs/Identity.json"
    },
    "evaluation": {
      "type": "object",
      "properties": {
        "metrics": {
          "type": "array",
          "items": {
            "$ref": "./defs/Metric.json"
          }
        }
      }
    },
    "model_description": {
      "$ref": "./defs/TemplatedDescription.json"
    }
  },
  "$defs": {
    "Identity": {
      "type": "object",
      "properties": {
        "model_name": {
          "type": "string"
        },
        "version": {
          "type": "string"
        },
        "overview": {
          "type": "string"
        }
      },
      "required": [
        "model_name"
      ]
    },
    "Metric": {
      "type": "object",
      "properties": {
        "type": {
          "type": "string"
        },
        "value": {
          "type": "number"
        },
        "slice": {
          "type": "string"
        },
        "confidence_interval": {
          "type": "object",
          "properties": {
            "lower_bound": {
              "type": "number"
            },
            "upper_bound": {
              "type": "number"
            }
          }
        },
        "x-assumptions": {
          "type": "string",
          "x-status": "experimental",
          "description": "Assumptions made when evaluating this metric"
        }
      },
      "required": [
        "type",
        "value"
      ]
    },
    "TemplatedDescription": {
      "type": "string",
      "pattern": "^This model contains \\{[^}]+\\} collected from \\{[^}]+\\} for the purpose of \\{[^}]+\\}\\.$",
      "description": "Must follow the template: 'This model contains {type of data} collected from {source} for the purpose of {intended use}.'",
      "default": "This model contains {type of data} collected from {source} for the purpose of {intended use}."
    }
  }
}