{
  "validation_profile": "financial",
  "identity": {
    "model_name": "CreditRiskML",
    "version": "4.0.3",
    "overview": "Predictive model for assessing credit default risk"
  },
  "evaluation": {
    "metrics": [
      {
        "type": "f1_score",
        "value": 0.845,
        "slice": "low_income_zip_codes",
        "confidence_interval": {
          "lower_bound": 0.81,
          "upper_bound": 0.87
        },
        "x-assumptions": "No synthetic data used, only customer-verified records."
      }
    ]
  },
  "model_description": "This model contains {credit history data} collected from {loan applications} for the purpose of {predicting borrower default risk}."
}